{
  "doc": "Muzzle flash: tiny forward fire cone and a light pop.",
  "count": 8,
  "lifetime": [0.03, 0.06],
  "speed": [1, 4],
  "spread": 20,
  "size": [0.05, 0.12],
  "color": "#fff3c0",
  "colorEnd": "#ff8a20",
  "gravity": 0,
  "light": { "color": "#ffc070", "intensity": 25, "range": 6, "seconds": 0.05 }
}
